{
  "version": "1.0",
  "metadata": {
    "event_id": "evt_1735372800",
    "timestamp": "2025-12-28T14:30:00Z",
    "source_video": "data/clips/20251228_143000_evt_1735372800.mp4",
    "duration_sec": 10.0,
    "fps": 15,
    "total_frames": 150,
    "extractor": {
      "engine": "yolov8",
      "model": "yolov8n-pose.pt",
      "version": "8.0.0"
    }
  },
  "keypoint_format": "coco17",
  "sequence": [
    {
      "frame_idx": 0,
      "timestamp": 0.0,
      "keypoints": {
        "nose": {
          "x": 0.52,
          "y": 0.15,
          "confidence": 0.95
        },
        "left_eye": {
          "x": 0.48,
          "y": 0.12,
          "confidence": 0.92
        },
        "right_eye": {
          "x": 0.56,
          "y": 0.12,
          "confidence": 0.91
        },
        "left_shoulder": {
          "x": 0.45,
          "y": 0.28,
          "confidence": 0.98
        },
        "right_shoulder": {
          "x": 0.58,
          "y": 0.27,
          "confidence": 0.97
        },
        "left_elbow": {
          "x": 0.42,
          "y": 0.42,
          "confidence": 0.9
        },
        "right_elbow": {
          "x": 0.61,
          "y": 0.41,
          "confidence": 0.89
        },
        "left_wrist": {
          "x": 0.4,
          "y": 0.56,
          "confidence": 0.75
        },
        "right_wrist": {
          "x": 0.63,
          "y": 0.55,
          "confidence": 0.78
        },
        "left_hip": {
          "x": 0.47,
          "y": 0.6,
          "confidence": 0.96
        },
        "right_hip": {
          "x": 0.53,
          "y": 0.6,
          "confidence": 0.95
        },
        "left_knee": {
          "x": 0.46,
          "y": 0.78,
          "confidence": 0.92
        },
        "right_knee": {
          "x": 0.54,
          "y": 0.78,
          "confidence": 0.91
        },
        "left_ankle": {
          "x": 0.45,
          "y": 0.95,
          "confidence": 0.88
        },
        "right_ankle": {
          "x": 0.55,
          "y": 0.95,
          "confidence": 0.87
        }
      },
      "bbox": {
        "x": 120,
        "y": 80,
        "width": 200,
        "height": 350
      },
      "derived_features": {
        "torso_angle": 12.5,
        "aspect_ratio": 1.75,
        "center_of_mass": {
          "x": 0.5,
          "y": 0.48
        }
      }
    },
    {
      "frame_idx": 1,
      "timestamp": 0.06666666666666667,
      "keypoints": {
        "nose": {
          "x": 0.521,
          "y": 0.15,
          "confidence": 0.95
        },
        "left_eye": {
          "x": 0.48,
          "y": 0.12,
          "confidence": 0.92
        },
        "right_eye": {
          "x": 0.56,
          "y": 0.12,
          "confidence": 0.91
        },
        "left_shoulder": {
          "x": 0.45,
          "y": 0.28,
          "confidence": 0.98
        },
        "right_shoulder": {
          "x": 0.58,
          "y": 0.27,
          "confidence": 0.97
        },
        "left_elbow": {
          "x": 0.42,
          "y": 0.42,
          "confidence": 0.9
        },
        "right_elbow": {
          "x": 0.61,
          "y": 0.41,
          "confidence": 0.89
        },
        "left_wrist": {
          "x": 0.4,
          "y": 0.56,
          "confidence": 0.75
        },
        "right_wrist": {
          "x": 0.63,
          "y": 0.55,
          "confidence": 0.78
        },
        "left_hip": {
          "x": 0.47,
          "y": 0.6,
          "confidence": 0.96
        },
        "right_hip": {
          "x": 0.53,
          "y": 0.6,
          "confidence": 0.95
        },
        "left_knee": {
          "x": 0.46,
          "y": 0.78,
          "confidence": 0.92
        },
        "right_knee": {
          "x": 0.54,
          "y": 0.78,
          "confidence": 0.91
        },
        "left_ankle": {
          "x": 0.45,
          "y": 0.95,
          "confidence": 0.88
        },
        "right_ankle": {
          "x": 0.55,
          "y": 0.95,
          "confidence": 0.87
        }
      },
      "bbox": {
        "x": 120,
        "y": 80,
        "width": 200,
        "height": 350
      },
      "derived_features": {
        "torso_angle": 12.0,
        "aspect_ratio": 1.2,
        "center_of_mass": {
          "x": 0.5,
          "y": 0.48
        }
      }
    },
    {
      "frame_idx": 2,
      "timestamp": 0.13333333333333333,
      "keypoints": {
        "nose": {
          "x": 0.522,
          "y": 0.15,
          "confidence": 0.95
        },
        "left_eye": {
          "x": 0.48,
          "y": 0.12,
          "confidence": 0.92
        },
        "right_eye": {
          "x": 0.56,
          "y": 0.12,
          "confidence": 0.91
        },
        "left_shoulder": {
          "x": 0.45,
          "y": 0.28,
          "confidence": 0.98
        },
        "right_shoulder": {
          "x": 0.58,
          "y": 0.27,
          "confidence": 0.97
        },
        "left_elbow": {
          "x": 0.42,
          "y": 0.42,
          "confidence": 0.9
        },
        "right_elbow": {
          "x": 0.61,
          "y": 0.41,
          "confidence": 0.89
        },
        "left_wrist": {
          "x": 0.4,
          "y": 0.56,
          "confidence": 0.75
        },
        "right_wrist": {
          "x": 0.63,
          "y": 0.55,
          "confidence": 0.78
        },
        "left_hip": {
          "x": 0.47,
          "y": 0.6,
          "confidence": 0.96
        },
        "right_hip": {
          "x": 0.53,
          "y": 0.6,
          "confidence": 0.95
        },
        "left_knee": {
          "x": 0.46,
          "y": 0.78,
          "confidence": 0.92
        },
        "right_knee": {
          "x": 0.54,
          "y": 0.78,
          "confidence": 0.91
        },
        "left_ankle": {
          "x": 0.45,
          "y": 0.95,
          "confidence": 0.88
        },
        "right_ankle": {
          "x": 0.55,
          "y": 0.95,
          "confidence": 0.87
        }
      },
      "bbox": {
        "x": 120,
        "y": 80,
        "width": 200,
        "height": 350
      },
      "derived_features": {
        "torso_angle": 11.5,
        "aspect_ratio": 1.2,
        "center_of_mass": {
          "x": 0.5,
          "y": 0.48
        }
      }
    }
  ],
  "analysis": {
    "fall_detected": true,
    "fall_frame_idx": 1,
    "fall_timestamp": 0.067,
    "recovery_frame_idx": null,
    "rule_triggered": "aspect_ratio_change"
  }
}